{
  "blocking_depths": [
    "VD0",
    "VD1"
  ],
  "depth_contract": {
    "VD0": "Historical symptom or root-cause narrative only; no executable current-workspace observation.",
    "VD1": "A current positive regression or static witness exists, but the historical failure mode is not recreated and dynamically rejected.",
    "VD2": "A focused current-design reproduction and fixed positive case exist with raw local observations, but no compile-success negative RTL or oracle version is bound.",
    "VD3": "Current-design raw cycle or transaction observations reject a compile-success negative RTL/oracle version and bind stable local artifacts.",
    "VD4": "VD3 plus current-design aggregate or frozen-system replay, explicit publication boundaries and independent review."
  },
  "design_id": "sha256:337de8bf9bb72a57ab50570313521cd282c49f88df9cb88417c47673af4a6968",
  "entries": [
    {
      "current_evidence": [
        {
          "path": "npc/rv64/eval/ppa/evidence/historical-defect-current.json",
          "sha256": "6937db456ec6ceed543be291e7c43c0feb358aa28549a08578855e1dedf27c45"
        }
      ],
      "depth_basis": [
        "The product-top raw scoreboard observes three committed and two selectively killed queue-head CSR births with lane1_fire=0; the memory-order case also proves older-store drain and younger-lane refetch after C1.",
        "The backend-only directed state counts one CSR dispatch, one younger STORE dispatch, one SQ allocation, one successful probe request/response, one exact STORE owner and zero physical writes in assertions-on and assertions-off modes.",
        "Current owner-lifetime RTL intentionally keeps mem_idle=0 for that backend-only state; it is recorded as a current guard rather than misreported as queue-head progress.",
        "A root-cone-equivalent historical transport-idle source reaches exactly one CSR C0/C1 and quiet C2 with zero younger STORE writes in both assertion configurations.",
        "Adding the historical mem_idle-and-mem_retire_quiet dependency compiles successfully in both assertion configurations and is rejected only at the dedicated bounded marker with mem_idle=1, mem_retire_quiet=0, hold=1, SQ count=1 and owner-live count=1.",
        "Runner v2 retains each raw Icarus image receipt but binds the summary to allocator-normalized VVP identities; two identical full replays produced a byte-identical summary while semantic-content unit tests remained fail-sensitive.",
        "The V14K current-design receipt binds the unchanged OooIntBackend owner cone and V14E queue-head assert/release plus three compile-success mutations to sha256:093c2380b997029944aa4462015d83711d7c5f1d52b15b4803c4515a581a7488; the historical reconstruction remains immutable.",
        "The V15G six-defect current receipt revalidates this bound evidence on sha256:f7a6845564f2d697fca9eac8bf9424136508a62c7fcc7851ad56c688dc2053f9 without rewriting historical artifacts or claiming ARCH_STABLE or PPA promotion.",
        "The V15Q six-defect current receipt revalidates the directed positive, compile-success negative and layered-system evidence on sha256:337de8bf9bb72a57ab50570313521cd282c49f88df9cb88417c47673af4a6968 without rewriting historical execution status or claiming ARCH_STABLE or PPA promotion."
      ],
      "domain": "rtl-liveness",
      "first_observed": "2026-07-05",
      "historical_symptom": "The queue-head CSR remains inflight with mem_quiet low while a younger store remains resident in the Store Queue, so neither the CSR nor the younger store can retire.",
      "id": "HIST-SER-QH-YOUNGER-STORE-CYCLE",
      "observation_cost": "high",
      "owner_paths": [
        "npc/rv64/vsrc/execute/OooIntBackend.v",
        "npc/rv64/vsrc/writeback/OooRob.v",
        "npc/rv64/testbench/tests/tb_ooo_int_backend.sv",
        "npc/rv64/testbench/tests/tb_ooo_core_top_glue.sv",
        ".github/task-runs/2026-07-29-rv64-hist-ser-qh-younger-store-cycle/run-historical-reconstruction.py"
      ],
      "priority_rank": 1,
      "recurrence_risk": "high",
      "required_backfill": [
        "Reopen if queue-head CSR packet single-dispatch, head0_csr_inflight frontend hold, SQ owner lifetime, mem_idle, mem_retire_quiet or OooRob mem_quiet wiring changes.",
        "Reopen if the deterministic reconstruction anchors stop being unique or either assertions-on/off historical cycle version is no longer compile-success and dynamically rejected."
      ],
      "root_cause": "The historical intermediate RTL required mem_idle and mem_retire_quiet for queue-head CSR retirement; mem_retire_quiet included sq_empty even though the resident SQ entry was younger than the CSR and could only be flushed after the CSR retired.",
      "severity": "critical",
      "source_artifacts": [
        {
          "path": "npc/rv64/design/arch/serialize-at-retire-phase1.md",
          "sha256": "b0c582eef1e639cd6f10ea4ad562cd77d9df45e6fa8e7d4da134413eacbc8897"
        }
      ],
      "status": "BACKFILLED",
      "title": "queue-head CSR waits on a younger SQ entry and forms a liveness cycle",
      "validation_depth": "VD3"
    },
    {
      "current_evidence": [
        {
          "path": "npc/rv64/eval/ppa/evidence/historical-defect-current.json",
          "sha256": "6937db456ec6ceed543be291e7c43c0feb358aa28549a08578855e1dedf27c45"
        }
      ],
      "depth_basis": [
        "A product-topology program creates the older queue-head CSR at PC 0x80000010 and the younger lane1 CSR at PC 0x8000001c through real frontend and control-plane transactions; the raw scoreboard does not force owner, stop, inflight, capture or commit signals.",
        "Current RTL in assertions-on and assertions-off modes observes six inflight hold cycles, zero orphan owner gap, zero stop drop, zero inflight can_run and zero younger lane1 overlap, with two exact C0 commits, two C1 applies and two quiet C2 observations.",
        "Deleting only the sequencer inflight hold compiles and survives this bounded trace because the current RunGate inflight owner prevents orphan cleanup; this is recorded as a successor-contract witness and not as a production deletion or PPA qualification.",
        "Deleting only the RunGate inflight owner compiles in both assertion configurations and is rejected with two orphan/busy gaps, two inflight can_run cycles and one real younger lane1 CSR capture while stop remains one.",
        "The combined historical-pre-T3U root-cone-equivalent version compiles in both assertion configurations. Assertions-on triggers the existing T3U/V9X owner checks; assertions-off reaches one stop drop, two inflight can_run cycles and one real younger lane1 CSR capture.",
        "All eight variants compile successfully and use the same raw product-topology scoreboard without event deduplication. Existing assertions remain present and are not weakened to collect later events.",
        "The current topology has ordinary_drain_root=0 because backend_drained requires ROB empty while the queue-head CSR is inflight; the causal record therefore distinguishes the historical drain narrative from the observed orphan-clear root.",
        "A full replay produced byte-identical summary and case logs plus stable allocator-normalized VVP identities. The focused runner/oracle unit tests pass 7/7, related V9O and standalone tests pass with assertions on/off, and the assertion-on module aggregate passes 113/113.",
        "The V14K current-design receipt binds unchanged OooStopPendingSequencer, OooFrontendRunGate and core-top testbench bytes plus V14E holder/stop positive and compile-success negative observations to sha256:093c2380b997029944aa4462015d83711d7c5f1d52b15b4803c4515a581a7488; the historical 8/8 matrix remains immutable.",
        "The V15G six-defect current receipt revalidates this bound evidence on sha256:f7a6845564f2d697fca9eac8bf9424136508a62c7fcc7851ad56c688dc2053f9 without rewriting historical artifacts or claiming ARCH_STABLE or PPA promotion.",
        "The V15Q six-defect current receipt revalidates the directed positive, compile-success negative and layered-system evidence on sha256:337de8bf9bb72a57ab50570313521cd282c49f88df9cb88417c47673af4a6968 without rewriting historical execution status or claiming ARCH_STABLE or PPA promotion."
      ],
      "domain": "rtl-liveness",
      "first_observed": "2026-07-05",
      "historical_symptom": "The pre-T3U queue-head CSR could leave the fetch head without a complete inflight stop owner: the frontend reopened before the older CSR reached C0 and a younger lane1 CSR entered the pending path. The original history attributed the state drop to ordinary drain; the current-topology reconstruction instead observes orphan owner cleanup with drain=0.",
      "id": "HIST-SER-QH-STOP-HOLD-DROP",
      "observation_cost": "medium",
      "owner_paths": [
        "npc/rv64/vsrc/control/OooStopPendingSequencer.v",
        "npc/rv64/vsrc/frontend/OooFrontendRunGate.v",
        "npc/rv64/vsrc/frontend/OooFrontend.v",
        "npc/rv64/vsrc/control/OooControlPlane.v",
        "npc/rv64/vsrc/control/OooPendingDrainResolveGate.v",
        "npc/rv64/testbench/tests/tb_ooo_core_top_glue.sv",
        ".github/task-runs/2026-07-29-rv64-hist-ser-qh-stop-hold-drop/run-stop-hold-matrix.py"
      ],
      "priority_rank": 2,
      "recurrence_risk": "high",
      "required_backfill": [
        "Reopen if queue-head CSR birth/inflight/C0/C1/C2, stop sequencer priority, RunGate owner/orphan/busy mapping, pending lane1 capture or drain ROB-empty semantics change.",
        "Reopen if either assertions-on/off historical-pre-T3U version no longer compiles or the raw scoreboard no longer rejects owner gap, premature can_run and real younger lane1 capture.",
        "Exact historical-source or VD4 claims require a separately bound historical snapshot plus aggregate/design-id independent review; this VD3 record does not qualify formal, full-system, architecture-stable, synthesis, STA or PPA conclusions."